{
  "$schema": "../../schemas/control-set.schema.json",
  "schemaVersion": "1.0",
  "_": "สำเนา OWASP ASVS 5.0.0 เฉพาะ Level 1 ดึงจากต้นทางที่ระบุด้านล่าง ไม่ได้เขียนขึ้นเอง · sha256 ของแต่ละบทคือไฟล์ต้นฉบับที่ใช้สร้างรายการนี้ ตรวจย้อนได้",
  "id": "owasp-asvs-5.0.0-l1",
  "name": "OWASP Application Security Verification Standard",
  "version": "5.0.0",
  "level": 1,
  "reference": "https://owasp.org/www-project-application-security-verification-standard/",
  "source": "https://github.com/OWASP/ASVS/tree/v5.0.0/5.0/en",
  "retrievedAt": "2026-09-23",
  "chapters": [
    {
      "id": "V1",
      "title": "Encoding and Sanitization",
      "sha256": "8c0e36a42c3cbf711e2579eb68e1fea8090f52301cac7c400d7c392207b24ee7",
      "sections": [
        {
          "id": "V1.2",
          "title": "Injection Prevention",
          "requirements": [
            {
              "id": "V1.2.1",
              "text": "Verify that output encoding for an HTTP response, HTML document, or XML document is relevant for the context required, such as encoding the relevant characters for HTML elements, HTML attributes, HTML comments, CSS, or HTTP header fields, to avoid changing the message or document structure."
            },
            {
              "id": "V1.2.2",
              "text": "Verify that when dynamically building URLs, untrusted data is encoded according to its context (e.g., URL encoding or base64url encoding for query or path parameters). Ensure that only safe URL protocols are permitted (e.g., disallow javascript: or data:)."
            },
            {
              "id": "V1.2.3",
              "text": "Verify that output encoding or escaping is used when dynamically building JavaScript content (including JSON), to avoid changing the message or document structure (to avoid JavaScript and JSON injection)."
            },
            {
              "id": "V1.2.4",
              "text": "Verify that data selection or database queries (e.g., SQL, HQL, NoSQL, Cypher) use parameterized queries, ORMs, entity frameworks, or are otherwise protected from SQL Injection and other database injection attacks. This is also relevant when writing stored procedures."
            },
            {
              "id": "V1.2.5",
              "text": "Verify that the application protects against OS command injection and that operating system calls use parameterized OS queries or use contextual command line output encoding."
            }
          ]
        },
        {
          "id": "V1.3",
          "title": "Sanitization",
          "requirements": [
            {
              "id": "V1.3.1",
              "text": "Verify that all untrusted HTML input from WYSIWYG editors or similar is sanitized using a well-known and secure HTML sanitization library or framework feature."
            },
            {
              "id": "V1.3.2",
              "text": "Verify that the application avoids the use of eval() or other dynamic code execution features such as Spring Expression Language (SpEL). Where there is no alternative, any user input being included must be sanitized before being executed."
            }
          ]
        },
        {
          "id": "V1.5",
          "title": "Safe Deserialization",
          "requirements": [
            {
              "id": "V1.5.1",
              "text": "Verify that the application configures XML parsers to use a restrictive configuration and that unsafe features such as resolving external entities are disabled to prevent XML eXternal Entity (XXE) attacks."
            }
          ]
        }
      ]
    },
    {
      "id": "V2",
      "title": "Validation and Business Logic",
      "sha256": "70ad0f68df22ddd825c2837e74999fa026851e75a3128372307685e2bb526969",
      "sections": [
        {
          "id": "V2.1",
          "title": "Validation and Business Logic Documentation",
          "requirements": [
            {
              "id": "V2.1.1",
              "text": "Verify that the application's documentation defines input validation rules for how to check the validity of data items against an expected structure. This could be common data formats such as credit card numbers, email addresses, telephone numbers, or it could be an internal data format."
            }
          ]
        },
        {
          "id": "V2.2",
          "title": "Input Validation",
          "requirements": [
            {
              "id": "V2.2.1",
              "text": "Verify that input is validated to enforce business or functional expectations for that input. This should either use positive validation against an allow list of values, patterns, and ranges, or be based on comparing the input to an expected structure and logical limits according to predefined rules. For L1, this can focus on input which is used to make specific business or security decisions. For L2 and up, this should apply to all input."
            },
            {
              "id": "V2.2.2",
              "text": "Verify that the application is designed to enforce input validation at a trusted service layer. While client-side validation improves usability and should be encouraged, it must not be relied upon as a security control."
            }
          ]
        },
        {
          "id": "V2.3",
          "title": "Business Logic Security",
          "requirements": [
            {
              "id": "V2.3.1",
              "text": "Verify that the application will only process business logic flows for the same user in the expected sequential step order and without skipping steps."
            }
          ]
        }
      ]
    },
    {
      "id": "V3",
      "title": "Web Frontend Security",
      "sha256": "02de197d5aa55592cfa524e66d4aa15bd3e8955e23e76438ac413c94172488fc",
      "sections": [
        {
          "id": "V3.2",
          "title": "Unintended Content Interpretation",
          "requirements": [
            {
              "id": "V3.2.1",
              "text": "Verify that security controls are in place to prevent browsers from rendering content or functionality in HTTP responses in an incorrect context (e.g., when an API, a user-uploaded file or other resource is requested directly). Possible controls could include: not serving the content unless HTTP request header fields (such as Sec-Fetch-\\*) indicate it is the correct context, using the sandbox directive of the Content-Security-Policy header field or using the attachment disposition type in the Content-Disposition header field."
            },
            {
              "id": "V3.2.2",
              "text": "Verify that content intended to be displayed as text, rather than rendered as HTML, is handled using safe rendering functions (such as createTextNode or textContent) to prevent unintended execution of content such as HTML or JavaScript."
            }
          ]
        },
        {
          "id": "V3.3",
          "title": "Cookie Setup",
          "requirements": [
            {
              "id": "V3.3.1",
              "text": "Verify that cookies have the 'Secure' attribute set, and if the '\\__Host-' prefix is not used for the cookie name, the '__Secure-' prefix must be used for the cookie name."
            }
          ]
        },
        {
          "id": "V3.4",
          "title": "Browser Security Mechanism Headers",
          "requirements": [
            {
              "id": "V3.4.1",
              "text": "Verify that a Strict-Transport-Security header field is included on all responses to enforce an HTTP Strict Transport Security (HSTS) policy. A maximum age of at least 1 year must be defined, and for L2 and up, the policy must apply to all subdomains as well."
            },
            {
              "id": "V3.4.2",
              "text": "Verify that the Cross-Origin Resource Sharing (CORS) Access-Control-Allow-Origin header field is a fixed value by the application, or if the Origin HTTP request header field value is used, it is validated against an allowlist of trusted origins. When 'Access-Control-Allow-Origin: *' needs to be used, verify that the response does not include any sensitive information."
            }
          ]
        },
        {
          "id": "V3.5",
          "title": "Browser Origin Separation",
          "requirements": [
            {
              "id": "V3.5.1",
              "text": "Verify that, if the application does not rely on the CORS preflight mechanism to prevent disallowed cross-origin requests to use sensitive functionality, these requests are validated to ensure they originate from the application itself. This may be done by using and validating anti-forgery tokens or requiring extra HTTP header fields that are not CORS-safelisted request-header fields. This is to defend against browser-based request forgery attacks, commonly known as cross-site request forgery (CSRF)."
            },
            {
              "id": "V3.5.2",
              "text": "Verify that, if the application relies on the CORS preflight mechanism to prevent disallowed cross-origin use of sensitive functionality, it is not possible to call the functionality with a request which does not trigger a CORS-preflight request. This may require checking the values of the 'Origin' and 'Content-Type' request header fields or using an extra header field that is not a CORS-safelisted header-field."
            },
            {
              "id": "V3.5.3",
              "text": "Verify that HTTP requests to sensitive functionality use appropriate HTTP methods such as POST, PUT, PATCH, or DELETE, and not methods defined by the HTTP specification as \"safe\" such as HEAD, OPTIONS, or GET. Alternatively, strict validation of the Sec-Fetch-* request header fields can be used to ensure that the request did not originate from an inappropriate cross-origin call, a navigation request, or a resource load (such as an image source) where this is not expected."
            }
          ]
        }
      ]
    },
    {